{
  "payerAddress": "0x742d35Cc6634C0532925a3b844Bc9e7595f0bEb",
  "payeeAddress": "0x8ba1f109551bD432803012645Hac136c22C5e2",
  "amount": 1000000000000000000,
  "chainId": 1,
  "cumulative": 5000000000000000000,
  "counter": 42,
  "expiry": 1735689600,
  "slipId": "550e8400-e29b-41d4-a716-446655440000",
  "contractAddress": "0x1234567890123456789012345678901234567890",
  "metadata": {
    "description": "Payment for services rendered",
    "invoiceNumber": "INV-2024-001",
    "tags": ["payment", "service"]
  },
  "signature": "0x1a2b3c4d5e6f7890abcdef1234567890abcdef1234567890abcdef1234567890abcdef1234567890abcdef1234567890abcdef1234567890abcdef12"
}

